Product, Review
Queen size Sheet Set, I ordered a king size set. Looks ok but it is not a 1200 thread Egyptian cotton fabric as advertised.
Waterproof Phone Pouch, It looks great and it is the correct size. It also protects my phone as long as I don't go near water.
Luxury Air Mattress, The automatic inflation process is working to fast as the SEC's one.
Pillows insert, This is not "Cannard Plumme" is Duck. I want my money.
Milk Frother Handheld\n, I loved this product. But they only have it in yellow color.   